{
  "$schema": "./schemas/study-lock.schema.json",
  "schema": "cordis.formal-study-lock/v1",
  "studyVersion": "0.1.0",
  "commitIdentity": {
    "name": "Stool233",
    "email": "christry.stool@gmail.com"
  },
  "repositories": {
    "cordis": {
      "path": "sources/cordis",
      "upstream": "https://github.com/cordiverse/cordis.git",
      "source": "https://github.com/Stool233/cordis.git",
      "branch": "research/cordis-formal-study",
      "baseline": "33cee0c972960eb72b1792b696c6ce897157200c",
      "revision": "23f5e7d6e4a0cf451567dad1caad7b4049df6992",
      "role": "authoritative executable specification and upstream implementation trace target",
      "license": "MIT",
      "ownedCommits": [
        "cd51867f98ecc208bc27b8037c90194e7291c310",
        "36e5ee6065615adb5b25fe098c8e78813a20bdaf",
        "18174ca2b1f8daa90567a78fdb4f83b5a1c7e9d0",
        "a0f8baa9b9abfee73292c525ebcd46103b175b0d",
        "23f5e7d6e4a0cf451567dad1caad7b4049df6992"
      ],
      "rewrittenCommits": [
        {
          "upstreamRevision": "ce854b593eae4d2ca6717945f26b85eb5f1ee264",
          "studyRevision": "cd51867f98ecc208bc27b8037c90194e7291c310",
          "subject": "feat: formalize Cordis paper conformance"
        },
        {
          "upstreamRevision": "33cee0c972960eb72b1792b696c6ce897157200c",
          "studyRevision": "36e5ee6065615adb5b25fe098c8e78813a20bdaf",
          "subject": "docs: summarize formal conformance work in Chinese"
        }
      ]
    },
    "paper": {
      "path": "sources/paper",
      "upstream": "https://github.com/cordiverse/paper.git",
      "source": "https://github.com/cordiverse/paper.git",
      "branch": "main",
      "baseline": "948a07b369c62adb3b12e102458be5c18dfb69b9",
      "revision": "948a07b369c62adb3b12e102458be5c18dfb69b9",
      "role": "fixed English paper source",
      "license": "NOASSERTION",
      "ownedCommits": [],
      "rewrittenCommits": []
    },
    "deepseekHarness": {
      "path": "sources/deepseek-harness",
      "upstream": "https://github.com/deepseek-ai/deepseek-harness.git",
      "source": "https://github.com/Stool233/deepseek-harness.git",
      "branch": "research/cordis-formal-study",
      "baseline": "f9df688cf1a6cd56efe518166f51d29cc8a029f6",
      "revision": "9a039fe3e17f0bd6fae09bdaae10d2fbfb59a21f",
      "role": "vendored Cordis and offline AgentLoop conformance target",
      "license": "MIT",
      "ownedCommits": [
        "8ea7a4aa3f5ffe804f04560ece139b24e19af6d6",
        "a9598b66ee117dd7e8a609c0b6c64fe87c251ad7",
        "9a039fe3e17f0bd6fae09bdaae10d2fbfb59a21f"
      ],
      "rewrittenCommits": [
        {
          "upstreamRevision": "f9df688cf1a6cd56efe518166f51d29cc8a029f6",
          "studyRevision": "8ea7a4aa3f5ffe804f04560ece139b24e19af6d6",
          "subject": "test: verify vendored Cordis paper conformance"
        }
      ]
    }
  },
  "paper": {
    "path": "sources/paper/paper.pdf",
    "sha256": "4d48478dc0b6222d9f74d7db10ee776449b1209eb112632336544d32a49db97f",
    "language": "en",
    "distribution": "referenced upstream; not included in evidence bundles"
  },
  "references": {
    "specula": {
      "repository": "https://github.com/specula-org/Specula.git",
      "commit": "c6aa3dfa41cd4bc7411fae40bd040924c70d9725",
      "version": "1.1.0",
      "role": "method and interactive trace-debugging reference only"
    }
  },
  "bootstrap": {
    "cordis": {
      "packageManager": "yarn@4.14.1",
      "lockPath": "locks/cordis.yarn.lock",
      "sha256": "b48729bfaa610ea6fcff3f249739891e2d1b97906c7e01d0e2cc4b7a326c125b"
    }
  },
  "toolchain": {
    "node": {
      "version": "24"
    },
    "java": {
      "version": "21"
    },
    "tlaTools": {
      "version": "1.8.0",
      "sha256": "ab323b79802aedc3203b3f9af37c6aca3ed43f4e0225b36f2aa77b26de46c05f"
    },
    "communityModules": {
      "version": "202505152026",
      "sha256": "044e8ecdfbca92d51d7eb4469422c2a7da1fe25dc8ad39c4a90e6622d6da4d99"
    }
  },
  "evidence": {
    "requiredProperties": [
      "WriteLocality",
      "LifoRecovery",
      "RecoveryExactness",
      "IndependentExchangeInvariant",
      "Preservation",
      "Ordering",
      "ResolutionCoherence",
      "Progress",
      "ProgressBound",
      "RuntimeRefinesPaper",
      "CanonicalTerminalEquality",
      "EventuallyCanonical"
    ],
    "coreScenarios": [
      "provider-consumer-reverse-exit",
      "async-consumer-teardown-guard",
      "concurrent-root-teardown-guard",
      "provider-identity-replacement",
      "dependency-loss-during-iteration",
      "dependency-return-during-unload",
      "generator-lifo-recovery",
      "top-level-concurrent-recovery",
      "partial-install-failure-rollback",
      "nested-registration-cascade",
      "isolation-realms",
      "confluence-left",
      "confluence-right"
    ],
    "deepseekScenarios": [
      "vendored-reentrant-dispose",
      "vendored-pending-effect",
      "vendored-async-cleanup-join",
      "deepseek-agent-loop-assembly"
    ],
    "coreScenarioCount": 13,
    "fullScenarioCount": 17,
    "prerequisiteAudits": [
      {
        "name": "cyclic-dependencies",
        "property": "Progress",
        "status": "not-applicable"
      },
      {
        "name": "non-independent-effects",
        "property": "Confluence",
        "status": "not-applicable"
      },
      {
        "name": "non-total-provision",
        "property": "Progress",
        "status": "not-applicable"
      }
    ],
    "mutations": [
      "remove-unload-guard",
      "compare-target-by-value",
      "fifo-recovery",
      "stale-committed-provider"
    ],
    "mutationCount": 4,
    "observationPointCount": 29
  }
}
